"gene","baseMean","log2FoldChange","lfcSE","pvalue","padj","LOC_ID","transcript","database","uniprot_accession","geneID","species","pident","length","mismatch","gapopen","qstart","qend","sstart","send","evalue","bitscore","reviewed","entryname","protein_name","gene_name","organism","prot_length","GO_ID","GO_BP","GO_MF","GO_CC","Genename_orderedlocus","Induction","Pathwaycommons","Reactome","Unipathway","Interacts_with"
"gene-LOC134707468|LOC134707468",30.177467606902,4.9533891655456,1.0693157081831,1.34909888284198e-07,4.51992980195693e-05,"LOC134707468","lcl|NC_086374.1_cds_XP_063423296.1_8526","sp","Q1HG43","DOXA1","HUMAN",30.466,279,187,7,31,855,8,283,9.35e-29,120,"reviewed","DOXA1_HUMAN","Dual oxidase maturation factor 1 (Dual oxidase activator 1) (Numb-interacting protein)","DUOXA1 NIP NUMBIP","Homo sapiens (Human)",343,"GO:0005783; GO:0005789; GO:0005886; GO:0008104; GO:0010729; GO:0015031; GO:0016020; GO:0019899; GO:0031252; GO:0042743; GO:0045666; GO:0050727; GO:2000609","hydrogen peroxide metabolic process [GO:0042743]; positive regulation of hydrogen peroxide biosynthetic process [GO:0010729]; positive regulation of neuron differentiation [GO:0045666]; protein localization [GO:0008104]; protein transport [GO:0015031]; regulation of inflammatory response [GO:0050727]; regulation of thyroid hormone generation [GO:2000609]","enzyme binding [GO:0019899]","cell leading edge [GO:0031252]; endoplasmic reticulum [GO:0005783]; endoplasmic reticulum membrane [GO:0005789]; membrane [GO:0016020]; plasma membrane [GO:0005886]",NA,NA,"Q1HG43;",NA,NA,"Q9NRD9"
"gene-LOC134707467|LOC134707467",49.2454237931421,2.40488022989708,0.846544088237719,0.000140988435530234,0.00843405447171905,"LOC134707467","lcl|NC_086374.1_cds_XP_063423294.1_8523","sp","Q8CIY2","DUOX1","RAT",41.748,1545,845,21,70,4605,29,1551,0,1154,"reviewed","DUOX1_RAT","Dual oxidase 1 (EC 1.11.1.-) (EC 1.6.3.1)","Duox1","Rattus norvegicus (Rat)",1551,"GO:0004601; GO:0005509; GO:0005783; GO:0005886; GO:0006590; GO:0006952; GO:0006979; GO:0009986; GO:0016175; GO:0016324; GO:0019221; GO:0020037; GO:0031252; GO:0042335; GO:0042446; GO:0042554; GO:0042744; GO:0043020; GO:0050665; GO:0051591; GO:0072593; GO:0090303; GO:0106293; GO:0106294; GO:2000147","cuticle development [GO:0042335]; cytokine-mediated signaling pathway [GO:0019221]; defense response [GO:0006952]; hormone biosynthetic process [GO:0042446]; hydrogen peroxide biosynthetic process [GO:0050665]; hydrogen peroxide catabolic process [GO:0042744]; positive regulation of cell motility [GO:2000147]; positive regulation of wound healing [GO:0090303]; reactive oxygen species metabolic process [GO:0072593]; response to cAMP [GO:0051591]; response to oxidative stress [GO:0006979]; superoxide anion generation [GO:0042554]; thyroid hormone generation [GO:0006590]","calcium ion binding [GO:0005509]; heme binding [GO:0020037]; NADH oxidase H202-forming activity [GO:0106293]; NADPH oxidase H202-forming activity [GO:0106294]; peroxidase activity [GO:0004601]; superoxide-generating NAD(P)H oxidase activity [GO:0016175]","apical plasma membrane [GO:0016324]; cell leading edge [GO:0031252]; cell surface [GO:0009986]; endoplasmic reticulum [GO:0005783]; NADPH oxidase complex [GO:0043020]; plasma membrane [GO:0005886]",NA,NA,NA,"R-RNO-209968;","UPA00194;",NA
"gene-LOC134720932|LOC134720932",213.492412490868,2.18587292312857,0.955355993404512,0.000577037808622408,0.0226741915388099,"LOC134720932","lcl|NC_086378.1_cds_XP_063439582.1_23872","tr","A0A193DUA2","A0A193DUA2","MYTCO",35.518,656,376,22,292,2181,105,739,8.49e-107,347,"unreviewed","A0A193DUA2_MYTCO","Byssal peroxidase-like protein 2",NA,"Mytilus coruscus (Sea mussel)",742,"GO:0004601; GO:0006979; GO:0020037; GO:0046872","response to oxidative stress [GO:0006979]","heme binding [GO:0020037]; metal ion binding [GO:0046872]; peroxidase activity [GO:0004601]",NA,NA,NA,NA,NA,NA,NA
"gene-LOC134725929|LOC134725929",110.867687797984,2.13445331774593,0.345865934637791,3.19038292199218e-11,8.52470316756311e-08,"LOC134725929","lcl|NC_086379.1_cds_XP_063446294.1_30613","sp","Q9VAF5","CAD99","DROME",30.744,309,169,13,253,1128,93,373,9.15e-29,124,"reviewed","CAD99_DROME","Cadherin-99C","Cad99C CG31009","Drosophila melanogaster (Fruit fly)",1706,"GO:0002385; GO:0005509; GO:0005886; GO:0005902; GO:0007156; GO:0007304; GO:0007305; GO:0007605; GO:0010008; GO:0016324; GO:0016339; GO:0017022; GO:0019722; GO:0031528; GO:0032529; GO:0032533; GO:0035239; GO:0044331; GO:0045176; GO:0098609; GO:2000370","apical protein localization [GO:0045176]; calcium-dependent cell-cell adhesion via plasma membrane cell adhesion molecules [GO:0016339]; calcium-mediated signaling [GO:0019722]; cell-cell adhesion [GO:0098609]; cell-cell adhesion mediated by cadherin [GO:0044331]; chorion-containing eggshell formation [GO:0007304]; follicle cell microvillus organization [GO:0032529]; homophilic cell adhesion via plasma membrane adhesion molecules [GO:0007156]; mucosal immune response [GO:0002385]; positive regulation of clathrin-dependent endocytosis [GO:2000370]; regulation of follicle cell microvillus length [GO:0032533]; sensory perception of sound [GO:0007605]; tube morphogenesis [GO:0035239]; vitelline membrane formation involved in chorion-containing eggshell formation [GO:0007305]","calcium ion binding [GO:0005509]; myosin binding [GO:0017022]","apical plasma membrane [GO:0016324]; endosome membrane [GO:0010008]; microvillus [GO:0005902]; microvillus membrane [GO:0031528]; plasma membrane [GO:0005886]",NA,"INDUCTION: Up-regulated in the adult anterior midgut after the ingestion of bacterial uracil. Strong up-regulation detected 1 hour, 2 hours and 16 hours after ingestion, whereas no up-regulation was detected at 4 hours. {ECO:0000269|PubMed:25639794}.",NA,NA,NA,"Q9V3Z6"
"gene-LOC134715973|LOC134715973",20.6388709123453,1.94485970077307,0.536874317461867,1.23516060708123e-05,0.00167814363158697,"LOC134715973","lcl|NC_086376.1_cds_XP_063434658.1_19597","sp","Q9WVR6","LAT2","RAT",36.952,479,297,3,172,1596,17,494,2.82e-98,310,"reviewed","LAT2_RAT","Large neutral amino acids transporter small subunit 2 (L-type amino acid transporter 2) (Solute carrier family 7 member 8)","Slc7a8 Lat2 Lat4","Rattus norvegicus (Rat)",533,"GO:0003333; GO:0005886; GO:0006865; GO:0009925; GO:0015101; GO:0015171; GO:0015175; GO:0015179; GO:0015180; GO:0015187; GO:0015190; GO:0015297; GO:0015349; GO:0015804; GO:0015807; GO:0015816; GO:0015820; GO:0015827; GO:0015829; GO:0016323; GO:0016324; GO:0019534; GO:0031528; GO:0035524; GO:0042605; GO:0046982; GO:0070327; GO:0089718; GO:1903801; GO:1904273","amino acid import across plasma membrane [GO:0089718]; amino acid transmembrane transport [GO:0003333]; amino acid transport [GO:0006865]; glycine transport [GO:0015816]; L-alanine import across plasma membrane [GO:1904273]; L-amino acid transport [GO:0015807]; L-leucine import across plasma membrane [GO:1903801]; L-leucine transport [GO:0015820]; neutral amino acid transport [GO:0015804]; proline transmembrane transport [GO:0035524]; thyroid hormone transport [GO:0070327]; tryptophan transport [GO:0015827]; valine transport [GO:0015829]","amino acid transmembrane transporter activity [GO:0015171]; antiporter activity [GO:0015297]; glycine transmembrane transporter activity [GO:0015187]; L-alanine transmembrane transporter activity [GO:0015180]; L-amino acid transmembrane transporter activity [GO:0015179]; L-leucine transmembrane transporter activity [GO:0015190]; neutral L-amino acid transmembrane transporter activity [GO:0015175]; organic cation transmembrane transporter activity [GO:0015101]; peptide antigen binding [GO:0042605]; protein heterodimerization activity [GO:0046982]; thyroid hormone transmembrane transporter activity [GO:0015349]; toxin transmembrane transporter activity [GO:0019534]","apical plasma membrane [GO:0016324]; basal plasma membrane [GO:0009925]; basolateral plasma membrane [GO:0016323]; microvillus membrane [GO:0031528]; plasma membrane [GO:0005886]",NA,NA,NA,"R-RNO-210991;R-RNO-352230;",NA,NA
"gene-LOC134687277|LOC134687277",22.84621161711,1.74050790240107,0.750648513427465,0.000570300833497351,0.0225198595138659,"LOC134687277","lcl|NC_086382.1_cds_XP_063403499.1_38680","sp","P42674","BP10","PARLI",38.554,249,140,6,265,984,64,308,8.9e-42,162,"reviewed","BP10_PARLI","Blastula protease 10 (EC 3.4.24.-)","BP10","Paracentrotus lividus (Common sea urchin)",597,"GO:0004222; GO:0005576; GO:0005938; GO:0006508; GO:0008270; GO:0048471","proteolysis [GO:0006508]","metalloendopeptidase activity [GO:0004222]; zinc ion binding [GO:0008270]","cell cortex [GO:0005938]; extracellular region [GO:0005576]; perinuclear region of cytoplasm [GO:0048471]",NA,NA,NA,NA,NA,NA
"gene-LOC134704886|LOC134704886",391.467166629939,1.64945801433021,0.319620831309124,1.11638042261761e-08,8.13536860700249e-06,"LOC134704886","lcl|NC_086373.1_cds_XP_063419741.1_4675","sp","P22105","TENX","HUMAN",31.346,654,303,30,43432,45297,222,761,3.11e-41,176,"reviewed","TENX_HUMAN","Tenascin-X (TN-X) (Hexabrachion-like protein)","TNXB HXBL TNX TNXB1 TNXB2 XB","Homo sapiens (Human)",4244,"GO:0005178; GO:0005201; GO:0005518; GO:0005576; GO:0005615; GO:0006631; GO:0006641; GO:0007155; GO:0007160; GO:0008201; GO:0008284; GO:0010718; GO:0030036; GO:0030155; GO:0030199; GO:0030334; GO:0031012; GO:0031175; GO:0032963; GO:0043231; GO:0045595; GO:0048251; GO:0062023; GO:0070062; GO:0090733; GO:0098609; GO:0098633; GO:1900748; GO:1904028; GO:1905935","actin cytoskeleton organization [GO:0030036]; cell adhesion [GO:0007155]; cell-cell adhesion [GO:0098609]; cell-matrix adhesion [GO:0007160]; collagen fibril organization [GO:0030199]; collagen metabolic process [GO:0032963]; elastic fiber assembly [GO:0048251]; fatty acid metabolic process [GO:0006631]; neuron projection development [GO:0031175]; positive regulation of cell fate determination [GO:1905935]; positive regulation of cell population proliferation [GO:0008284]; positive regulation of collagen fibril organization [GO:1904028]; positive regulation of epithelial to mesenchymal transition [GO:0010718]; positive regulation of vascular endothelial growth factor signaling pathway [GO:1900748]; regulation of cell adhesion [GO:0030155]; regulation of cell differentiation [GO:0045595]; regulation of cell migration [GO:0030334]; triglyceride metabolic process [GO:0006641]","collagen binding [GO:0005518]; collagen fibril binding [GO:0098633]; extracellular matrix structural constituent [GO:0005201]; heparin binding [GO:0008201]; integrin binding [GO:0005178]","collagen-containing extracellular matrix [GO:0062023]; extracellular exosome [GO:0070062]; extracellular matrix [GO:0031012]; extracellular region [GO:0005576]; extracellular space [GO:0005615]; intracellular membrane-bounded organelle [GO:0043231]; tenascin complex [GO:0090733]",NA,NA,"P22105;","R-HSA-3000178;",NA,"Q8N9N5; P01137; Q8N9N5-2; P40199; P42858; P78424; Q96PF1"
"gene-LOC134708520|LOC134708520",169.343292121257,1.4245575896151,0.367057832415888,4.44363092439861e-06,0.000774350988912593,"LOC134708520","lcl|NC_086374.1_cds_XP_063425209.1_10900","sp","Q61P40","TBH1","CAEBR",31.871,342,214,8,481,1467,199,534,5.71e-40,157,"reviewed","TBH1_CAEBR","Tyramine beta-hydroxylase (EC 1.14.17.-) (Tyramine beta-monooxygenase) (TbetaM)","tbh-1 CBG07714","Caenorhabditis briggsae",585,"GO:0004500; GO:0004836; GO:0005507; GO:0005615; GO:0006589; GO:0008021; GO:0030667; GO:0042420; GO:0042421","dopamine catabolic process [GO:0042420]; norepinephrine biosynthetic process [GO:0042421]; octopamine biosynthetic process [GO:0006589]","copper ion binding [GO:0005507]; dopamine beta-monooxygenase activity [GO:0004500]; tyramine-beta hydroxylase activity [GO:0004836]","extracellular space [GO:0005615]; secretory granule membrane [GO:0030667]; synaptic vesicle [GO:0008021]",NA,NA,NA,NA,NA,NA
"gene-LOC134707932|LOC134707932",15.2711218781394,1.38262811236556,0.416765504082929,3.5361174883264e-05,0.00339207128849738,"LOC134707932","lcl|NC_086374.1_cds_XP_063424176.1_9618","sp","Q3MHG7","URIC","BOVIN",48.333,300,151,1,7,906,9,304,1.73e-102,305,"reviewed","URIC_BOVIN","Uricase (EC 1.7.3.3) (Urate oxidase)","UOX","Bos taurus (Bovine)",304,"GO:0004846; GO:0005777; GO:0006145; GO:0019628","purine nucleobase catabolic process [GO:0006145]; urate catabolic process [GO:0019628]","urate oxidase activity [GO:0004846]","peroxisome [GO:0005777]",NA,NA,NA,NA,"UPA00394;",NA
"gene-LOC134715513|LOC134715513",46.143997751227,1.34715349909835,0.472060188071131,0.000151538716491444,0.00886667409777677,"LOC134715513","lcl|NC_086373.1_cds_XP_063433809.1_650","sp","Q8NBI5","S43A3","HUMAN",25.692,506,312,11,49,1482,18,487,4.8e-41,157,"reviewed","S43A3_HUMAN","Equilibrative nucleobase transporter 1 (Protein FOAP-13) (Solute carrier family 43 member 3)","SLC43A3 ENBT1 PSEC0252","Homo sapiens (Human)",491,"GO:0015207; GO:0015208; GO:0015245; GO:0016323; GO:0035344; GO:0042910","hypoxanthine transport [GO:0035344]","adenine transmembrane transporter activity [GO:0015207]; fatty acid transmembrane transporter activity [GO:0015245]; guanine transmembrane transporter activity [GO:0015208]; xenobiotic transmembrane transporter activity [GO:0042910]","basolateral plasma membrane [GO:0016323]",NA,NA,"Q8NBI5;",NA,NA,"P55072"
"gene-LOC134685599|LOC134685599",92.6271178045081,1.31317763549465,0.529220576895702,0.000418526855052236,0.0182332134244496,"LOC134685599","lcl|NC_086381.1_cds_XP_063401567.1_35534","sp","A4IGY6","S39AE","XENTR",34.753,446,219,11,55,1254,27,446,7.74e-68,226,"reviewed","S39AE_XENTR","Metal cation symporter ZIP14 (Solute carrier family 39 member 14) (Zrt- and Irt-like protein 14) (ZIP-14)","slc39a14","Xenopus tropicalis (Western clawed frog) (Silurana tropicalis)",462,"GO:0005381; GO:0005384; GO:0005385; GO:0005765; GO:0005886; GO:0006882; GO:0015086; GO:0015296; GO:0016323; GO:0016324; GO:0031901; GO:0031902; GO:0032869; GO:0033212; GO:0034755; GO:0045745; GO:0051344; GO:0055071; GO:0071333; GO:0071421; GO:0071577; GO:0071578; GO:0098662; GO:0098739","cellular response to glucose stimulus [GO:0071333]; cellular response to insulin stimulus [GO:0032869]; import across plasma membrane [GO:0098739]; inorganic cation transmembrane transport [GO:0098662]; intracellular zinc ion homeostasis [GO:0006882]; iron import into cell [GO:0033212]; iron ion transmembrane transport [GO:0034755]; manganese ion homeostasis [GO:0055071]; manganese ion transmembrane transport [GO:0071421]; negative regulation of cyclic-nucleotide phosphodiesterase activity [GO:0051344]; positive regulation of G protein-coupled receptor signaling pathway [GO:0045745]; zinc ion import across plasma membrane [GO:0071578]; zinc ion transmembrane transport [GO:0071577]","cadmium ion transmembrane transporter activity [GO:0015086]; iron ion transmembrane transporter activity [GO:0005381]; manganese ion transmembrane transporter activity [GO:0005384]; monoatomic anion:monoatomic cation symporter activity [GO:0015296]; zinc ion transmembrane transporter activity [GO:0005385]","apical plasma membrane [GO:0016324]; basolateral plasma membrane [GO:0016323]; early endosome membrane [GO:0031901]; late endosome membrane [GO:0031902]; lysosomal membrane [GO:0005765]; plasma membrane [GO:0005886]",NA,NA,NA,"R-XTR-442380;",NA,NA
"gene-LOC134710394|LOC134710394",201.191204052123,1.28538000895355,0.274803512003551,1.35327239579549e-07,4.51992980195693e-05,"LOC134710394","lcl|NC_086375.1_cds_XP_063426819.1_11946","sp","P36573","LEC1","CAEEL",35.115,262,156,7,877,1647,21,273,5.49e-35,136,"reviewed","LEC1_CAEEL","32 kDa beta-galactoside-binding lectin (32 kDa GBP)","lec-1 W09H1.6","Caenorhabditis elegans",279,"GO:0016936; GO:0030246; GO:0045121; GO:0060102",NA,"carbohydrate binding [GO:0030246]; galactoside binding [GO:0016936]","collagen and cuticulin-based cuticle extracellular matrix [GO:0060102]; membrane raft [GO:0045121]",NA,NA,NA,"R-CEL-6798695;",NA,NA
"gene-LOC134706753|LOC134706753",104.500355872113,1.2355105849742,0.247203111717838,2.62578675644246e-08,1.40322044264285e-05,"LOC134706753","lcl|NC_086374.1_cds_XP_063422037.1_7024","sp","Q66I24","ASSY","DANRE",69.75,400,121,0,22,1221,6,405,0,595,"reviewed","ASSY_DANRE","Argininosuccinate synthase (EC 6.3.4.5) (Citrulline--aspartate ligase)","ass1 zgc:92051","Danio rerio (Zebrafish) (Brachydanio rerio)",414,"GO:0000050; GO:0000053; GO:0004055; GO:0005524; GO:0005737; GO:0005829; GO:0006526","arginine biosynthetic process [GO:0006526]; argininosuccinate metabolic process [GO:0000053]; urea cycle [GO:0000050]","argininosuccinate synthase activity [GO:0004055]; ATP binding [GO:0005524]","cytoplasm [GO:0005737]; cytosol [GO:0005829]",NA,NA,NA,NA,"UPA00068;UPA00158;",NA
"gene-LOC134716897|LOC134716897",324.124427171692,1.2344751282371,0.299828811957362,1.77987694901594e-06,0.000365833169828508,"LOC134716897","lcl|NC_086376.1_cds_XP_063435982.1_20269","sp","Q8N2E2","VWDE","HUMAN",27.647,340,181,10,13687,14604,772,1080,3.27e-24,118,"reviewed","VWDE_HUMAN","von Willebrand factor D and EGF domain-containing protein","VWDE","Homo sapiens (Human)",1590,"GO:0005102; GO:0005576; GO:0009986",NA,"signaling receptor binding [GO:0005102]","cell surface [GO:0009986]; extracellular region [GO:0005576]",NA,NA,"Q8N2E2;",NA,NA,NA
"gene-LOC134721315|LOC134721315",240.964647514478,1.22696167095938,0.265415800576268,1.77741478886394e-07,5.21409611821681e-05,"LOC134721315","lcl|NC_086373.1_cds_XP_063440290.1_1607","sp","Q8R5I6","GSTM4","MOUSE",48.372,215,110,1,1,642,1,215,3.11e-71,219,"reviewed","GSTM4_MOUSE","Glutathione S-transferase Mu 4 (EC 2.5.1.18) (GST class-mu 4) (GSTM4-4) (Glutathione transferase GSTM7-7) (Leukotriene C4 synthase GSTM4) (EC 4.4.1.20)","Gstm4 Gstm7 Gstm7-7","Mus musculus (Mouse)",218,"GO:0004364; GO:0004464; GO:0005829; GO:0006749; GO:0018916; GO:0019899; GO:0042178; GO:0042759; GO:0042803; GO:0043295; GO:0045171","glutathione metabolic process [GO:0006749]; long-chain fatty acid biosynthetic process [GO:0042759]; nitrobenzene metabolic process [GO:0018916]; xenobiotic catabolic process [GO:0042178]","enzyme binding [GO:0019899]; glutathione binding [GO:0043295]; glutathione transferase activity [GO:0004364]; leukotriene-C4 synthase activity [GO:0004464]; protein homodimerization activity [GO:0042803]","cytosol [GO:0005829]; intercellular bridge [GO:0045171]",NA,NA,NA,"R-MMU-156590;R-MMU-9026762;",NA,NA
"gene-LOC134721144|LOC134721144",36.8869918960375,1.22517312412436,0.378920917248988,4.70452707959242e-05,0.00405499882473256,"LOC134721144","lcl|NC_086378.1_cds_XP_063440012.1_24403","sp","P48416","CP10","LYMST",29.98,497,315,13,226,1680,69,544,2.66e-58,206,"reviewed","CP10_LYMST","Cytochrome P450 10 (EC 1.14.-.-) (CYPX)","CYP10","Lymnaea stagnalis (Great pond snail) (Helix stagnalis)",545,"GO:0004497; GO:0005506; GO:0005743; GO:0006700; GO:0006704; GO:0008203; GO:0016705; GO:0020037; GO:0034650; GO:0071375","C21-steroid hormone biosynthetic process [GO:0006700]; cellular response to peptide hormone stimulus [GO:0071375]; cholesterol metabolic process [GO:0008203]; cortisol metabolic process [GO:0034650]; glucocorticoid biosynthetic process [GO:0006704]","heme binding [GO:0020037]; iron ion binding [GO:0005506]; monooxygenase activity [GO:0004497]; oxidoreductase activity, acting on paired donors, with incorporation or reduction of molecular oxygen [GO:0016705]","mitochondrial inner membrane [GO:0005743]",NA,NA,NA,NA,NA,NA
"gene-LOC134708517|LOC134708517",301.151674883742,1.02078793954379,0.456484302670134,0.000813948494775534,0.0282327405977535,"LOC134708517","lcl|NC_086374.1_cds_XP_063425205.1_10896","sp","Q61P40","TBH1","CAEBR",31.894,301,191,6,481,1356,199,494,2.46e-38,152,"reviewed","TBH1_CAEBR","Tyramine beta-hydroxylase (EC 1.14.17.-) (Tyramine beta-monooxygenase) (TbetaM)","tbh-1 CBG07714","Caenorhabditis briggsae",585,"GO:0004500; GO:0004836; GO:0005507; GO:0005615; GO:0006589; GO:0008021; GO:0030667; GO:0042420; GO:0042421","dopamine catabolic process [GO:0042420]; norepinephrine biosynthetic process [GO:0042421]; octopamine biosynthetic process [GO:0006589]","copper ion binding [GO:0005507]; dopamine beta-monooxygenase activity [GO:0004500]; tyramine-beta hydroxylase activity [GO:0004836]","extracellular space [GO:0005615]; secretory granule membrane [GO:0030667]; synaptic vesicle [GO:0008021]",NA,NA,NA,NA,NA,NA
"gene-LOC134694047|LOC134694047",127.708284622956,0.937369409011305,0.346922986575312,0.000255711706442057,0.0126529940669107,"LOC134694047","lcl|NC_086385.1_cds_XP_063411112.1_45985","sp","O01393","UNC9","CAEEL",40,375,215,4,61,1182,20,385,4.1e-99,303,"reviewed","UNC9_CAEEL","Innexin unc-9 (Uncoordinated protein 9)","unc-9 R12H7.1","Caenorhabditis elegans",386,"GO:0005243; GO:0005886; GO:0005911; GO:0005921; GO:0034220; GO:0040017; GO:0051015; GO:0055077","monoatomic ion transmembrane transport [GO:0034220]; positive regulation of locomotion [GO:0040017]","actin filament binding [GO:0051015]; gap junction channel activity [GO:0005243]; gap junction hemi-channel activity [GO:0055077]","cell-cell junction [GO:0005911]; gap junction [GO:0005921]; plasma membrane [GO:0005886]",NA,NA,NA,NA,NA,NA
"gene-LOC134687436|LOC134687436",3547.67952488706,0.93492759295171,0.124722787416782,3.58543285570524e-15,2.87408297713332e-11,"LOC134687436","lcl|NC_086373.1_cds_XP_063403806.1_4017","sp","P28491","CALR","PIG",71.72,343,94,3,46,1071,17,357,6.35e-161,462,"reviewed","CALR_PIG","Calreticulin (CRP55) (Calregulin) (Endoplasmic reticulum resident protein 60) (ERp60) (HACBP)","CALR","Sus scrofa (Pig)",417,"GO:0005509; GO:0005576; GO:0005789; GO:0005829; GO:0006457; GO:0009986; GO:0030246; GO:0033018; GO:0036503; GO:0044194; GO:0050821; GO:0051082; GO:0060473","ERAD pathway [GO:0036503]; protein folding [GO:0006457]; protein stabilization [GO:0050821]","calcium ion binding [GO:0005509]; carbohydrate binding [GO:0030246]; unfolded protein binding [GO:0051082]","cell surface [GO:0009986]; cortical granule [GO:0060473]; cytolytic granule [GO:0044194]; cytosol [GO:0005829]; endoplasmic reticulum membrane [GO:0005789]; extracellular region [GO:0005576]; sarcoplasmic reticulum lumen [GO:0033018]",NA,NA,NA,"R-SSC-1236974;R-SSC-3000480;R-SSC-901042;R-SSC-983170;",NA,NA
"gene-LOC134701377|LOC134701377",24.9215924165003,0.932437270366443,0.418145166430532,0.000825468359954814,0.0282775827922982,"LOC134701377","lcl|NW_026963317.1_cds_XP_063418587.1_52275","sp","P45878","FKBP2","MOUSE",73.759,141,36,1,1,423,1,140,3.87e-74,220,"reviewed","FKBP2_MOUSE","Peptidyl-prolyl cis-trans isomerase FKBP2 (PPIase FKBP2) (EC 5.2.1.8) (13 kDa FK506-binding protein) (13 kDa FKBP) (FKBP-13) (FK506-binding protein 2) (FKBP-2) (Immunophilin FKBP13) (Rotamase)","Fkbp2 Fkbp13","Mus musculus (Mouse)",140,"GO:0003755; GO:0005783; GO:0005789; GO:0061077","chaperone-mediated protein folding [GO:0061077]","peptidyl-prolyl cis-trans isomerase activity [GO:0003755]","endoplasmic reticulum [GO:0005783]; endoplasmic reticulum membrane [GO:0005789]",NA,NA,NA,NA,NA,NA
"gene-LOC134687586|LOC134687586",125.116889556837,0.914345220439983,0.279334861302244,4.65835033652801e-05,0.00405499882473256,"LOC134687586","lcl|NC_086382.1_cds_XP_063404066.1_39410","sp","Q9XS79","HEM1","DELLE",50.391,639,243,10,10,1761,7,626,0,572,"reviewed","HEM1_DELLE","5-aminolevulinate synthase, non-specific, mitochondrial (ALAS-H) (EC 2.3.1.37) (5-aminolevulinic acid synthase 1) (Delta-ALA synthase 1) (Delta-aminolevulinate synthase 1)","ALAS1 ALS1","Delphinapterus leucas (Beluga whale)",640,"GO:0003870; GO:0005743; GO:0005759; GO:0006782; GO:0030170; GO:0042541; GO:0048821; GO:1903412","erythrocyte development [GO:0048821]; hemoglobin biosynthetic process [GO:0042541]; protoporphyrinogen IX biosynthetic process [GO:0006782]; response to bile acid [GO:1903412]","5-aminolevulinate synthase activity [GO:0003870]; pyridoxal phosphate binding [GO:0030170]","mitochondrial inner membrane [GO:0005743]; mitochondrial matrix [GO:0005759]",NA,NA,NA,NA,"UPA00251;",NA
"gene-LOC134717428|LOC134717428",73.2370019409147,0.908409571860654,0.258313948746216,1.90995498188117e-05,0.00221815469077613,"LOC134717428","lcl|NC_086373.1_cds_XP_063436054.1_943","sp","Q62186","SSRD","MOUSE",43.243,148,84,0,73,516,25,172,1.21e-46,153,"reviewed","SSRD_MOUSE","Translocon-associated protein subunit delta (TRAP-delta) (Signal sequence receptor subunit delta) (SSR-delta)","Ssr4","Mus musculus (Mouse)",172,"GO:0005784; GO:0012505",NA,NA,"endomembrane system [GO:0012505]; Sec61 translocon complex [GO:0005784]",NA,NA,NA,NA,NA,NA
"gene-LOC134715335|LOC134715335",97.0646730565239,0.900151289612235,0.381511525906453,0.000629578956840918,0.0239180327869043,"LOC134715335","lcl|NC_086376.1_cds_XP_063433514.1_18229","sp","G5EBQ8","CHS2","CAEEL",34.188,936,520,17,3526,6138,497,1401,1.54e-148,509,"reviewed","CHS2_CAEEL","Chitin synthase chs-2 (EC 2.4.1.16) (Chitin-UDP acetyl-glucosaminyl transferase chs-2)","chs-2 F48A11.1","Caenorhabditis elegans",1668,"GO:0004100; GO:0005886; GO:0006031; GO:0006038; GO:0030428; GO:0061063; GO:0071944","cell wall chitin biosynthetic process [GO:0006038]; chitin biosynthetic process [GO:0006031]; positive regulation of nematode larval development [GO:0061063]","chitin synthase activity [GO:0004100]","cell periphery [GO:0071944]; cell septum [GO:0030428]; plasma membrane [GO:0005886]",NA,NA,NA,NA,NA,NA
"gene-LOC134681433|LOC134681433",222.993325388265,0.883480520963468,0.293876459605731,0.000111543287583913,0.00751370582582055,"LOC134681433","lcl|NC_086380.1_cds_XP_063397133.1_33746","sp","Q5VU97","CAHD1","HUMAN",25.765,1079,712,35,52,3123,22,1066,8.26e-99,345,"reviewed","CAHD1_HUMAN","VWFA and cache domain-containing protein 1 (Cache domain-containing protein 1)","CACHD1 KIAA1573 VWCD1","Homo sapiens (Human)",1274,"GO:0005245; GO:0005891",NA,"voltage-gated calcium channel activity [GO:0005245]","voltage-gated calcium channel complex [GO:0005891]",NA,NA,"Q5VU97;",NA,NA,NA
